{
  "$schema": "https://json-schema.org/draft/2020-12/schema",
  "$id": "https://software-bench.local/schemas/mcp-application.schema.json",
  "title": "Software Benchmark application MCP specification",
  "type": "object",
  "additionalProperties": false,
  "required": ["name", "version", "description", "tools"],
  "properties": {
    "name": {"type": "string", "minLength": 1},
    "version": {"type": "string", "minLength": 1},
    "description": {"type": "string", "minLength": 1},
    "tools": {
      "type": "array",
      "minItems": 1,
      "items": {
        "type": "object",
        "additionalProperties": false,
        "required": ["name", "description", "input_schema", "command"],
        "properties": {
          "name": {
            "type": "string",
            "pattern": "^[A-Za-z][A-Za-z0-9_.-]{0,63}$"
          },
          "description": {"type": "string", "minLength": 1},
          "input_schema": {
            "type": "object",
            "required": ["type", "properties"],
            "properties": {
              "type": {"const": "object"},
              "properties": {"type": "object"},
              "required": {
                "type": "array",
                "uniqueItems": true,
                "items": {"type": "string"}
              },
              "additionalProperties": {"type": "boolean"}
            }
          },
          "command": {
            "type": "array",
            "minItems": 1,
            "items": {"type": "string", "minLength": 1}
          },
          "timeout_seconds": {
            "type": "number",
            "exclusiveMinimum": 0,
            "maximum": 1800
          },
          "mutating": {"type": "boolean"}
        }
      }
    }
  }
}
